option_id,option_name,description,scientific_value,reproducibility_value,implementation_risk,compute_cost,continuity_with_phase52,diagnostic_support_from_phase53,claim_boundary_safety,recommendation,rationale
A,Controlled seed123 and seed202 replication,"Authorize a separate Phase 55 for exactly seed123 and seed202 under the fixed Phase 52 128x128, 40-epoch protocol.",high,highest_direct_three_seed_comparison,low_to_moderate_controlled_reuse,moderate_two_bounded_runs_plus_diagnostics,highest_only_seed_changes,strong_with_seven_high_risk_cases_retained,high_if_bounded_to_tested_three_seed_scope,authorize_next_phase,Directly addresses the unresolved seed-sensitivity question while holding the established training and diagnostic protocol fixed.
B,Seed123-only pilot,Authorize seed123 only and require another decision before seed202.,moderate,partial_two_seed_evidence_only,low,lower_initial_cost_but_additional_review_cycle,high_only_seed_changes,sufficient_but_unnecessarily_staged,high,not_preferred,It reduces immediate compute but delays the predefined three-seed comparison even though the fixed protocol and diagnostics are ready.
C,Defer replication and authorize 256x256,Change resolution before evaluating seed sensitivity at 128x128.,medium_but_confounded,low_for_current_seed_question,high_new_resolution_and_resource_profile,high,low_changes_resolution,does_not_support_resolution_expansion,medium,defer,A resolution change would confound attribution before the established 128x128 protocol has bounded replication evidence.
D,Defer training for reporting or manuscript work,"Continue reporting, visualization, and manuscript work without new training.",moderate_for_reporting,none_for_seed_sensitivity,low,low,high_reporting_only,high_for_bounded_reporting,highest_if_limitations_remain_explicit,allowed_parallel_work_not_selected,"Useful non-training work, but it leaves the principal seed-robustness gap unresolved."
E,Defer all expansion because evidence is insufficient,"Authorize no training when required evidence is missing, contradictory, or inadequate for controlled replication.",low_unless_evidence_checks_fail,none,low_operational_high_stagnation,none,none,fallback_for_failed_review_only,highest,fail_closed_fallback,Required if evidence validation fails; the reviewed Phase 52/53 artifacts otherwise support the bounded Option A design.
